no	SRP	Cluster	2nd	Center	cg_internal	title	(select from list)	start_Planned	start_Actual	end_Planned	end_Actual	contact	rep_org_name	rep_org_type	part_org_name	part_org_role	Description	regions	countries	effort_by_basin	Admin	Site	yearly_budget	currency	(select from list)	W1&2	W3	Bilateral	Total	Nile	Volta & Niger	Limpopo & Zambezi	Amu Darya & Sur Darya	Tigris & Euphrates	Indus & Ganges	Mekong	Andes	Other	Global
1	1	1.1		12.IWMI	1.1.1	Enhancing Success of Smallholder Irrigation in Southern Africa						Pius Chilonda	IWMI	80 | Academic, Training and Research			Zimbabwe Small Irrigation Scheme This activity targets productivity of smallholder farmers using irrigation schemes in Masvingo province of Zimbabwe.  (i) Undertake baseline studies to define operational partnerships, methodology and rehabilitation approach; (ii) Rehabilitate two pilot schemes; (iii ) Prepare for up-scaling the rehabilitation of 8 other schemes.	SAFR	Zimbabwe	Limpopo & Zambezi (100)	Masvingo province	10 schemes	909013	USD	CRP - Water, Land and Ecosystems	$539,327		$369,686	$909,013			100%							
2	1	1.1		12.IWMI	1.1.2	Stakeholder engagement with implementing partners in eastern and southern Africa; increasing implementation capacity and community engagement in AWM						Nicole Lefore	IWMI	80 | Academic, Training and Research			learning alliance/action research on community engagement; continued work with spate irrigation; gender research (TBD)	EAFR; SAFR		Nile, Limpopo & Zambezi (50/50)			1196178	USD	CRP - Water, Land and Ecosystems	$709,705		$486,473	$1,196,178	50%		50%							
3	1	1.1	4.1	5.CPWF	1.1.3	Small-scale water infrastructure in the Limpopo						 Jiyani	CPWF	80 | Academic, Training and Research			Research on improved establishment, rehabilitation and operation of small water infrastructure, including rainwater harvesting, for multiple uses, in the Limpopo basin. Specific activities include an inventory of SWI, reasons for success or failure of different SWI operations, and guidelines for improvements in governance, institutions and management relating to SWI. 	SAFR		Limpopo & Zambezi (100)			480205	USD	CRP - Water, Land and Ecosystems	$480,205			$480,205			100%							
4	1	1.1	4.1	5.CPWF	1.1.4	Integrated management of small reservoirs for multiple uses						 Cecchi	CPWF	80 | Academic, Training and Research			Research on improved small reservoir management in the Volta basin, in the context of all water harvesting infrastructures, with a special focus on the relationships among  agricultural intensification, aquatic weeds, and system resilience	WAFR		Volta & Niger (100)			241921	USD	CRP - Water, Land and Ecosystems		$241,921		$241,921		100%								
5	1	1.1		6.ICARDA	1.1.5	Building and using a multiscale water and nutrients model including crop, farm, irrigation systems, canal supply system and drainage system to assess the water and nutrients/salts balance, processes and dynamics.   						 Karrou; Oweis	ICARDA	80 | Academic, Training and Research			Secondary data on water inputs/outputs, salt build-up and rainfall will be collected   Soil mositure and crops data will be collected from field experiments conducted in 2013        Furher calibration and test of two models SaltMed and CropSyst 	NAFR	Egypt	Nile (100)			425000	USD	CRP - Water, Land and Ecosystems	$96,000	$165,000	$164,000	$425,000	100%									
6	1	1.1		9.IFPRI	1.1.6	Energy use in irrigated agriculture						 Ringler	FPRI	80 | Academic, Training and Research			The project assesses the relative use and cost of energy in agriculture with a focus on irrigation, examines the relative contribution of energy to crop productivity and cost, and through using data as input into mathematical models assesses agricultural productivity and farm incomes under alternative energy price scenarios; and environmental outcomes under these scenarios, in particular greenhouse gas emissions and water\ quality.	EAFR; SASI	Ethiopia; Bangladesh	Nile, Indus & Ganges (70/30)			273173	USD	CRP - Water, Land and Ecosystems	$273,173			$273,173	70%					30%				
7	1	1.1		9.IFPRI	1.1.7	Environmental Management Options and Delivery Mechanisms to Reduce Malaria Transmission in Uganda (6059-001)						 Ringler	FPRI	80 | Academic, Training and Research			Proof-of-concept for the suitability of addressing agricultural productivity and malaria outcomes jointly through enhanced environmental management as an innovative extension mechanism. 	EAFR	Uganda	Nile (100)			13902	USD	CRP - Water, Land and Ecosystems			$13,902	$13,902	100%									
8	1	1.2		12.IWMI	1.2.1	Improving canal irrigation performance in Asia				30-Nov-14		Arif Anwar	IWMI	80 | Academic, Training and Research			Revitalizing Irrigation in Pakistan This activity aims at transformation of surface and groundwater management in the Indus Basin Irrigation System to enhance food security, reduce poverty and adapt to uncertainties brought about by both climate change and changing water demand. It will pilot new systems for main canal management, and develop effective support systems for Farmers’ Organizations based in part on other South Asian models while at the same time pushing beyond conventional Participatory Irrigation Management (PIM) /Irrigation Management Transfer (IMT) approaches.	SASI	Pakistan	Indus & Ganges (100)			2407531	USD	CRP - Water, Land and Ecosystems	$1,428,414		$979,117	$2,407,531						100%				
9	1	1.2		12.IWMI	1.2.2	Improving Water Productivity						K; Robyn Palanisami; Johnston	IWMI	80 | Academic, Training and Research			1.Quick study of tanks in east India and Nepal to prepare the main proposal.  Comparison of the time series data from 1997 to 2010 on tank irrigation based rice cultivation.	SASI	India; Nepal	Indus & Ganges (100)			124213	USD	CRP - Water, Land and Ecosystems	$73,697		$50,516	$124,213						100%				
10	1	1.2		6.ICARDA	1.2.3	Salinity mapping of Iraq agricultural lands and assessment of the sources and distribution of the lower Tigres/Euphrates river water using remote sensing, GIS and historic land and river flow data						 Ziadat	ICARDA	80 | Academic, Training and Research			Soil salinization is caused by various natural and/or human-induced factors. The consequences are many and most importantly the reduction of yield and eventually low income, increase of un-cultivated land and consequently high levels of immigration. The individual and collective factors that cause excessive soil salinity is site specific and complicated. However, understanding the distribution and extent of these factors is indispensible to suggest effective remedial interventions. GIS and remote sensing are viable tools to facilitate this understanding. The activity aims at analyzing available data and capitalizing on local knowledge and expertise to map soil and water salinity and ultimately provide information about the distribution and causes of soil salinization. This will provide basis for suggesting relevant intervention to deal with various cases	WANA	Iraq	Tigris & Euphrates (100)			350000	USD	CRP - Water, Land and Ecosystems	$114,000	$118,000	$118,000	$350,000					100%					
11	1	1.2		8.ICRISAT	1.2.4	Enhancing bluewater use efficiency in the SAT						 Sawargaonkar	ICRISAT	80 | Academic, Training and Research			Demostrating micro irrigation and other improved irrigation management options including supplemental irrigation at research station and pilot watersheds; Demostrating short duration and improved crop varieties; Experimenting/validating use of Water impact calculator (WIC) for irrigation scheduling in differnet soils and climatic conditions; Demostrating various landform and land management practices at pilot sites.	SASI	India	Other (100)			483000	USD	CRP - Water, Land and Ecosystems	$199,480		$283,520	$483,000									100%	
12	1	1.2		9.IFPRI	1.2.5	Technical assistance for the strategic research for sustainable food and nutrition security in Asia (RETA 7648-RE):  Water Component (6904-001)						 Zhu	FPRI	80 | Academic, Training and Research			"Increasing food production while reducing agricultural water use is a key to resolving the emerging challenges for food security and water sustainability in Asia. This study aims to answer the following main research questions centered on the central theme of “less water, more food” under the specific agricultural and water resources contexts of China, India and Vietnam. The study aims to address the following research questions, in particular:
1. What is the present status of social and technological infrastructure supporting water use and management in agriculture and beyond in the case study basins and countries? What policies affect inter- and intra-sectoral water allocation?  
2. What are the barriers to adoption of water saving technologies at the national level in general and at the case study sites in particular? Barrier identification needs to examine both socioeconomic and technological aspects, incorporating surveyed opinions from farmers and water managers. 
3. What are the promising water saving policies, technologies and management strategies for the case study basins/sites or countries that may prompt food security and water sustainability? 
"	EASI; SASI; SEAS	China; India; Vietnam	Mekong, Andes, Other (33/33/33)			8340	USD	CRP - Water, Land and Ecosystems			$8,340	$8,340							33%	33%	33%	
13	1	1.3		12.IWMI	1.3.1	Improving Water Productivity						Ravinder Malik	IWMI	80 | Academic, Training and Research			2.Provide a comprehensive review of the current status of uptake and investment in agricultural water management in Cambodia, with a particular focus on trends in small scale and groundwater irrigation.	SEAS	Cambodia	Indus & Ganges, Mekong (70/30)			796478	USD	CRP - Water, Land and Ecosystems	$472,559		$323,919	$796,478						70%	30%			
14	1	1.3	5.1	5.CPWF	1.3.2	Resource profiles, extrapolation domains, and land-use patterns in the Ganges						Andrew Nelson	CPWF	80 | Academic, Training and Research			Research to define where and when different improved water storage practices are likely to be effective in improving livelihoods and production system productivity in coastal areas of the Ganges. Activities include identifying relevant spatial and survey data, coordinated soil and water salinity monitoring, and tracking recent evolution of cropping systems (emphasis on rice-based systems) in the study area.  	SASI	Bangladesh; India	Indus & Ganges (100)			291049	USD	CRP - Water, Land and Ecosystems	$291,049			$291,049						100%				
15	1	1.3	4.2	5.CPWF	1.3.3	Productive, profitable, and resilient agriculture and aquaculture systems in the Ganges						 Humphreys	CPWF	80 | Academic, Training and Research			Research to improve the productivity and resilience of agricultural and aquacultural systems in study sites of Ganges coastal areas. Specific activities include team building, literature reviews, farm surveys, and on-farm trials for rice varieties, alternative cropping patterns, and rice-aquaculture systems, being mindful of opportunites presented through market value chains	SASI	Bangladesh	Indus & Ganges (100)			473153	USD	CRP - Water, Land and Ecosystems	$473,153			$473,153						100%				
16	1	1.3	4.2	5.CPWF	1.3.4	Water governance and community-based management in the Ganges						 Mukherji	CPWF	80 | Academic, Training and Research			Research to understand and improve community management of fresh water storage infrastructure in polders in coastal areas of the Ganges. (Improved management may be a necessary precursor to intensified cropping patterns.) Specific activities include secondary information review, key informant interviews, mapping of polder infrastructure, mapping of land use and inundation levels, institutional surveys, and polder case studies.	SASI	Bangladesh	Indus & Ganges (100)			383093	USD	CRP - Water, Land and Ecosystems	$383,093			$383,093						100%				
17	1	1.3	4.2	5.CPWF	1.3.5	Assessment of the impact of anticipated external drivers of change on water resources of the coastal zone in the Ganges						 Khan	CPWF	80 | Academic, Training and Research			Research to assess the impat of external drivers of change on water resources of coastal areas of Ganges. Specific activities include characterization of study areas, definition of key drivers through literature reviews and key informant surveys, and modeling of the effect of climate change on water levels, flow and salinity, and the long-term feasibility of polder management innovations	SASI	Bangladesh	Indus & Ganges (100)			332960	USD	CRP - Water, Land and Ecosystems	$332,960			$332,960						100%				
18	1	1.3		9.IFPRI	1.3.6	Evaluating the impact of irrigation on ecosystem services (ES) and smallholder resilience in Nepal						 Zhang	FPRI	80 | Academic, Training and Research			Irrigation agriculture can make important contributions to food security, improved nutrition and rural prosperity. However, empirical evidence on the impact of irrigation on ES and smallholders’ resilience is lacking, with a few existing studies showing mixed results. For example, while some studies argue that irrigation contributes to crop diversity by extending the growing season and broadening crop choices, others show that irrigation leads to reduced crop diversity due to mono-cropped high yield varieties replacing local varieties. Evidence on the impact on land use change is also lacking. While some have argued that irrigation reduces pressure on the surrounding forest resource, grazing and marginal lands because of increased cropping intensification, others have suggested the reverse trend. The exact changes remain unclear and need to be quantified in order to understand the impact on natural/semi-natural and fragile ecosystems. Irrigation has the potential to help smallholders reduce their risks and vulnerability to shocks by diversifying activities. A deeper look is needed to understand how irrigation has contributed to farmers’ resilience, both positively and negatively, by addressing important factors such as access to irrigation, seasonality of irrigation, multiple use of water, and access to natural resources, accounting for changes in ES underlined by biodiversity, intensification, and land use change. The research will improve our understanding of the impact of small-scale irrigation schemes on ES and smallholders’ resilience to natural and socio-economic changes in the Terai plain of Nepal. We combine the Nepal Living Standards Survey data with primary data to be collected through village and household surveys. The survey follows a 2-stage random sampling design of agricultural communities and households within them, post-stratifying by income level, type of irrigation project, and spatial location in the scheme. Remote sensing data on land cover/use will be used to assess land use change before/after establishing the scheme. 	SASI	Nepal	Indus & Ganges (100)			165575	USD	CRP - Water, Land and Ecosystems	$165,575			$165,575						100%				
19	2	2		12.IWMI	2.0.1	MUS						Barbara van Koppen	IWMI	80 | Academic, Training and Research			The MUS Group aims to improve advocacy for the delivery of multiple use water services (MUS) as a better way to use water for poverty reduction, gender equity and peri-urban and rural development. To this end, the MUS Group facilitates information sharing, supports original research and documentation, synthesizes findings, and promotes implementation and learning across the water and development sectors.	Global		Other (100)			18922	USD	CRP - Water, Land and Ecosystems	 $14,922 	 $-   	 $4,000 	$18,922									100%	
20	2	2		3.CIAT	2.0.2	SRP coordination, representation and strategic studies						 Bossio	CIAT	80 | Academic, Training and Research			Leadership of Rainfed SRP; Participation in WLE MT and  cross cutting themes; strategic papers on ES&R; representation of WLE and Rainfed	Global		00 | Global			250631	USD	CRP - Water, Land and Ecosystems	$250,631			$250,631										100%
21	2	2		3.CIAT	2.0.3	Impact pathways, social and institutional baselines and future scenarios for study landscapes						 Snyder	CIAT	80 | Academic, Training and Research			2013: Development and implementation of social, gender and institutional baselines, participatory scenario buiding for analysis of futures and possible trajectories of change, and engagement with CAADP and other decision makers and change actors to develop impact pathways  for three study landscapes in Africa.  2014-2015: Interventions identified will then be tested with action field research alongside farmers and implementers (Govt., NGOs,) and lessons outscaled for wider impact 	Africa		Nile, Volta & Niger, Limpopo & Zambezi (33/34/33)			75000	USD	CRP - Water, Land and Ecosystems	$75,000			$75,000	33%	34%	33%							
22	2	2.1		10.IITA	2.1.1	Evaluate early maturing resilient maize varieties for response to N in the Sudan Savanna Agroecology						 Kamara; Badu-Apraku; Ewansiha; Jibrin	IITA	80 | Academic, Training and Research			Evaluate 5 early-maturing maize varieites under a range of N levels inorder to estalbish optimum N requirment of early maturing maize in the Sudan Savannas	EAFR	Sudan	Volta & Niger (100)			57750	USD	CRP - Water, Land and Ecosystems	$57,750			$57,750		100%								
23	2	2.1		10.IITA	2.1.2	Soybean response to innoculation 						 Kamara; Jemo; Jibrin	IITA	80 | Academic, Training and Research			Evaluating soyben response to Rhizobium innoculation with or without P fertilization	WAFR	Nigeria	Volta & Niger (100)			21000	USD	CRP - Water, Land and Ecosystems	$21,000			$21,000		100%								
24	2	2.1		10.IITA	2.1.3	Improving Sorghum and millet production systms				2013		 Abdoulaye	IITA	80 | Academic, Training and Research			Technicla backstopping of KNARDA  and Demonstration of PICS technology inproject villages	WAFR	Nigeria	Volta & Niger (100)			88200	USD	CRP - Water, Land and Ecosystems			$88,200	$88,200		100%								
25	2	2.1		10.IITA	2.1.4	 Improving the livelihoods of smallholder farmers in drought-prone areas of sub-saharan Africa and South Asia through enhanced grain legume production and productivity. Tropical Legumes-II (Phase 2)				2014		 Ousmane; Boahen; Kamara	IITA	80 | Academic, Training and Research			Improving the livelihoods of smallholder farmers in drought-prone areas of sub-saharan Africa and South Asia through enhanced grain legume production and productivity. Tropical Legumes-II (Phase 2) http://www.icrisat.org/tropicallegumesII/	SSA; SASI		Volta & Niger, Limpopo & Zambezi (50/50)			355705	USD	CRP - Water, Land and Ecosystems		$355,705		$355,705		50%	50%							
26	2	2.1		12.IWMI	2.1.5	Sustainable increase in productivity of rainfed landscapes		1-Mar-11		28-Feb-14		Robyn Johnston	IWMI	80 | Academic, Training and Research			"Compilation and finalization of information required to formulate strategies for increasing the productivity in rainfed systems will be undertaken for each of the pilot sites. There are five phases to achieving the aforementioned outcome that includes; (1) the identification and screening of a large number possible management options (technologies and approaches); (2) a short listing of options for preliminary evaluation and comparison; (3) spatial assessment of dependencies and interactions between combinations of options within the context of a landscape-scale strategy; (4) detailed ex ante evaluation of the potential impacts and outcomes of strategies, taking account of interactions and synergies at a macro-scale; and (5) monitoring and evaluation. This will require field assessments, data collection, and participatory assessment at each of the pilot sites in which the project is being implemented. 
Further, it is anticipated that over the coming reporting period an approach will be made to the donor for a continuance of the project into a second phase with partners that would assess the value of the framework developed and to promote the out-scaling of this approach."	SSA; SEAS		Nile,Volta & Niger,Limpopo & Zambezi, Mekong (25 each)			222885	USD	CRP - Water, Land and Ecosystems	$100,000	$0	$122,885	$222,885	25%	25%	25%				25%			
27	2	2.1		3.CIAT	2.1.6	Reinvesting in soil quality: the basis for long-term gains in productivity and ecosystem services				2014		 Kizito	CIAT	80 | Academic, Training and Research			 Analyse the impact of field-based interventions on soils, water and landscape functions, to inform development decisions and investment to achieve improved productivity and equity of benefits in landscapes in selected regions of West, East and South Africa. 	WAFR; EAFR; SAFR		Nile, Volta & Niger, Limpopo & Zambezi (34/33/33)			782000	USD	CRP - Water, Land and Ecosystems	$212,000	$570,000		$782,000	34%	33%	33%							
28	2	2.1		3.CIAT	2.1.7	Deliver legume and innoculant technologies to farmers throughout SSA (D&D) working directly with 225,000 farm households						 Huising	CIAT	80 | Academic, Training and Research			Key BNF technologies, legume enterprises, production and processing strategies, markets and extension events are identified and advanced through the N2Africa project http://www.n2africa.org/	SSA		Nile (100)			755744	USD	CRP - Water, Land and Ecosystems			$755,744	$755,744	100%									
29	2	2.1		3.CIAT	2.1.8	Baseline and M&E to target and monitor N2fixation technologies implemented, resource materials and training programs undertaken to support uptake of N2fixation technologies						 De Wolf; Musyoka	CIAT	80 | Academic, Training and Research			Establish a baseline of the current status of N2-fixation; distribute BNF resource materials to educational institutions and provide web based support on key BNF methods and techniques; train private sector partners on innoculant production and quality control			Nile (100)			514879	USD	CRP - Water, Land and Ecosystems			$514,879	$514,879	100%									
30	2	2.1		3.CIAT	2.1.9	Identify varieties of legumes (grain, tree and fodder) with high  BNF potential and adaptation to biotic and abiotic stress 						 Baijukya	CIAT	80 | Academic, Training and Research			Select best varieties of legumes for high N2-fixation capacity and adaptation to abiotic [low soil P, soil acidity, etc] and biotic stresses [pests and diseases]; and explore their  potential for intensive meat and milk production and environmental services			Nile (100)			448521	USD	CRP - Water, Land and Ecosystems			$448,521	$448,521	100%									
31	2	2.1		3.CIAT	2.1.10	Identify best fit agricultural practices for maximizing potential of legumes, the need to innoculate and evaluate their contribution to systems productivity						 Baijukya; Franke; Woomer; Karanja; Mazvita	CIAT	80 | Academic, Training and Research			Identify best-fit agronomic practices (system design, need for amendments) and evaluate their contributions to system productivity and livelihoods with specific attention to trade-off analysis between competing enterprises; Assess the need-to-inoculate for the target legumes and identify elite strains across the impact zones.			Nile (100)			396739	USD	CRP - Water, Land and Ecosystems			$396,739	$396,739	100%									
32	2	2.1		3.CIAT	2.1.11	Explore the contribution of soil quality in regional yield gaps and associated management				2014		 Kihara	CIAT	80 | Academic, Training and Research			Linking tools and assessments for crop and yield gap modeling and capacity building  in East, West and Southern Africa http://www.yieldgap.org/	WAFR; EAFR; SAFR		00 | Global			257693	USD	CRP - Water, Land and Ecosystems	$85,000		$172,693	$257,693										100%
33	2	2.1		4.CIP	2.1.12	Defining management strategies to improve soil carbon, nutrients and water use efficiencies in potato- and sweet potato-based systems and modeling their impact at different spatial and temporal scales						 Posadas; Quiroz	CIP	80 | Academic, Training and Research			This activity covers several issues faced by scientist when proposing alternatives to intensify farming and improve land use and ecosystems services at landscape level in rainfed systems. It includes the characterization and modeling of shallow groundwater level dynamics, testing of water management schemes to increase the efficiency in the use of water, assessing soil carbon and nutrient dynamics and use efficiencies at different temporal and spatial scales. A limiting factor in modeling soil-carbon-nutrients-water relations across scales is the lack of good quality data at the resolutions needed. The research proposed focuses on generating and processing remotely sensed information to be used as ancillary data. To assess the robustness of the procedures tested, the theory will be developed in data-rich environments to ascertain the biases introduced as data scarcity increases. We propose using non-linear processes to characterize and model the processes of interest. Tools and methods will be programmed in open source software and national partners in developing countries will be trained in their use, once validated.	SAME		Andes, Global (50/50)	Central Sierra		194387	USD	CRP - Water, Land and Ecosystems	$194,387			$194,387								50%		50%
34	2	2.1	4.1	5.CPWF	2.1.13	Integrated rainwater management strategies-technologies, institutions and policies in the Nile						 Langan	CPWF	80 | Academic, Training and Research			Research on improved rainwater management at the landscape level in three sites in the Nile basin. Activities include site characterization, hydrometerological data collection, identification of site-level livelihoods issues and opportunities, and establishment of innovation platforms for participatory development of improved RWM strategies for agricultural diversification and intensification, using market value chains.	EAFR	Ethiopia	Nile (100)			558118	USD	CRP - Water, Land and Ecosystems	$558,118			$558,118	100%									
