no	SRP	Cluster	2nd	Center	cg_internal	title	(select from list)	start_Planned	start_Actual	end_Planned	end_Actual	contact	rep_org_name	rep_org_type	part_org_name	part_org_role	Description	regions	countries	effort_by_basin	Admin	Site	yearly_budget	currency	(select from list)	W1&2	W3	Bilateral	Total	Nile	Volta & Niger	Limpopo & Zambezi	Amu Darya & Sur Darya	Tigris & Euphrates	Indus & Ganges	Mekong	Andes	Other	Global
35	2	2.1	4.1	5.CPWF	2.1.14	Coordination and multi-stakeholder platforms in the Nile  (coordination and change project)						 Duncan; Langan	CPWF	80 | Academic, Training and Research			Multiple activities related to fostering cross-project integration, maintaining basin research program coherence, engaging with senior policymakers, exploring scaling out opportunities, providing communications leadership, and participating in project M&E	EAFR	Ethiopia	Nile (100)			475322	USD	CRP - Water, Land and Ecosystems	$475,322			$475,322	100%									
36	2	2.1		5.CPWF	2.1.15	Farm systems and risk management In the Limpopo						 Van Rooyen	CPWF	80 | Academic, Training and Research			Research to improve livelihoods through more productive rainfed crop and livestock technologies and investments in the Limpopo, with an emphasis on those linked to livestock market value chains. Specific activities include innovation platforms to develop site-specific solutions, and crop and livestock modeling to develop scenarios for subsequent field testing by farmers. 	SAFR		Limpopo & Zambezi (100)			448525	USD	CRP - Water, Land and Ecosystems	$448,525			$448,525			100%							
37	2	2.1	5.1	5.CPWF	2.1.16	Integrated management of rainwater for crop-livestock agroecosystems						 Ayantunde	CPWF	80 | Academic, Training and Research			Research on improved livelihood options in the Volta basin, especially market value chains, learning platforms, and participatory management of rainwater management infrastructure, to improve performance of crop livestock systems	WAFR		Volta & Niger (100)			337525	USD	CRP - Water, Land and Ecosystems		$337,525		$337,525		100%								
38	2	2.1		6.ICARDA	2.1.17	Economic optimization of water allocation from Tadal reserviour to cropping systems downstream including summer full irrigation and winter supplemental irrigation. Optimization modeling including various water management options and crop combinations. 						 Karrou; Oweis	ICARDA	80 | Academic, Training and Research				NAFR	Morocco	Nile (100)	Oum Rabia basin	Tadal reservoir	350000	USD	CRP - Water, Land and Ecosystems	$128,000	$111,000	$111,000	$350,000	100%									
39	2	2.1		8.ICRISAT	2.1.18	Develop and promote low-cost runoff harvesting and soil conserving systems for different rainfall zones				2013		 Garg	ICRISAT	80 | Academic, Training and Research				SASI		00 | Global			543400	USD	CRP - Water, Land and Ecosystems	$424,984		 $118,416 	$543,400										100%
40	2	2.1		8.ICRISAT	2.1.19	Enhancing greenwater and use efficiency in the SAT				2013		 G Sawargaonkar	ICRISAT	80 | Academic, Training and Research				SASI		00 | Global			230650	USD	CRP - Water, Land and Ecosystems	$89,954		$140,697	$230,650										100%
41	2	2.1		8.ICRISAT	2.1.20	Integrated Management of Water for Productivity and Livelihood Security under Variable and Changing Climatic Conditions in Eastern & Central Africa				Dec-13		 K.P.C. Rao	ICRISAT	80 | Academic, Training and Research			"Even though most countries in Eastern Africa have adequate water resources, they face an economic water scarcity due to inadequate investments in water management systems. 
Investments in agricultural water can contribute to agricultural growth by encouraging intensification and diversification of agricultural activities. In contrast to past interventions, which mainly focused on farm level interventions, this project employs Integrated Watershed Management (IWM) approach that links production, conservation and livelihoods of people in a given watershed"	EAFR	Eritrea; Ethiopia; Kenya; Madagascar; Rwanda	Volta & Niger, Other (25/75)			84000	USD	CRP - Water, Land and Ecosystems			 $84,000 	$84,000		25%							75%	
42	2	2.2		10.IITA	2.2.1	Evaluate host/rhizobia interactions and assess the contribution of N2 fixation to system productivity across three agro-ecologies				2014		 Boahen	IITA	80 | Academic, Training and Research			Use several soybean genotypes and several Bradyrhizobium strains to identify best strains for specific genotypes, assess N2 fixation and quantify N left over by soybean for the suceeding crop	SAFR		Limpopo & Zambezi (100)			28875	USD	CRP - Water, Land and Ecosystems	$28,875			$28,875			100%							
43	2	2.2		10.IITA	2.2.2	Assess the yield responses of sesame genotypes to N and P fertility mangement for responsive soils in low rainfall agroecologies				2013		 Boahen	IITA	80 | Academic, Training and Research			Apply various levels of N and P fertilizers to several sesame genotypes and evaluate their effects on growth, yield components and yields across low rainfll ecologies	SAFR		Limpopo & Zambezi (100)			28875	USD	CRP - Water, Land and Ecosystems	$28,875			$28,875			100%							
44	2	2.2		10.IITA	2.2.3	Evaluate the impact of low nutrient-high durability mulch and inorganic C (biochar) on soil properties and root & tuber yields 				2013		 Hauser	IITA	80 | Academic, Training and Research			Evaluate the impact of low nutrient-high durability mulch and inorganic C (biochar) on soil properties and root & tuber yields 	WAFR		Volta & Niger (100)			93750	USD	CRP - Water, Land and Ecosystems	$93,750			$93,750		100%								
45	2	2.2		10.IITA	2.2.4	Putting Nitrogen Fixation to Work for Smallholder Farmers in Africa (N2Africa)				2013		 Dianda; Jemo; Masso; Vanlauwe	IITA	80 | Academic, Training and Research			Evalaute and disseminate grain legumes and innoculant technologies among small	Africa		Volta & Niger, Global (50/50)			1029353	USD	CRP - Water, Land and Ecosystems			$1,029,353	$1,029,353		50%								50%
46	2	2.2		10.IITA	2.2.5	Design and evaluate technological packages that exploit the beneficial effects of native soils microorganisms to maximise food productivity and minimize environmental impact on agricultural lands in West africa				2013		 Jemo; Masso; Abaidoo; Vanlauwe	IITA	80 | Academic, Training and Research			Evaluate technological packages that exploit the beneficial effects of native soils microorganisms to maximise food productivity and minimize environmental impact on agricultural lands in West Africa	WAFR		Volta & Niger, Global (50/50)			1212129	USD	CRP - Water, Land and Ecosystems			$1,212,129	$1,212,129		50%								50%
47	2	2.2		10.IITA	2.2.6	Putting Nitrogen Fixation to Work for Smallholder Farmers in DRC, Liberia and Sierra Leone				2013		 Vanlauwe; Kamara; James; Tegbaru	IITA	80 | Academic, Training and Research				MAFR; WAFR	Congo DRC; Liberia; Sierra Leone	Volta & Niger, Global (50/50)			366223	USD	CRP - Water, Land and Ecosystems			$366,223	$366,223		50%								50%
48	2	2.2		3.CIAT	2.2.7	Restoration and conservation of biodiversity in El Salvador through the adaptation and dissemination of a slash and mulch agroforestry system (USAID funded project - May 2012 to 2017)				2017		 Castro; Fonte	CIAT	80 | Academic, Training and Research			Workshops, Stakeholder-to-stakeholder knowledge and experience sharing; Establishment of plots for the development and adaptation of slash and mulch based AFS; Baseline assessments of plot scale ecosystem services (ES) in the study area; Participatory adaptation and evaluation of integrated pest management options to replace the use of pesticides in production plots, with emphasize on herbicides	CAMC	El Salvador	Other (100)			159258	USD	CRP - Water, Land and Ecosystems			$159,258	$159,258									100%	
49	2	2.2	5.2	3.CIAT	2.2.8	Strategic landscape studies in Meso-America and the Andes: 1) Development of the Latin-American Soil Information System (SISLAC); 2) landscape assessment of forest change from QSMAS; 3) Program development - Landscape diversification in Andes 4) Cross learning exchange CA and Andes						Augusto Castro; Glenn Hyman; Owens; Marcela Quintero; Tapasco	CIAT	80 | Academic, Training and Research			1) Joint effort including 20 Latinamerican countries, FAO-Global Soil Partnership (donor), ISRIC (collaborator), and EMBRAPA and CIAT (coordinators) for the consolidation and harmonization of information (soil profiles and maps at country level) and the generation of new country and regional digital soil maps; 2) Develop proposal to address socio-economic factors of land use, promising fallow diversification options and the role of farmscape composition and organization in overall farm productivity and agroecosystem functioning in Andean Agroecosystems ;3)  Quantify  dynamics of forest regrowth in the reference area of QSMAS in Honduras, and the impact of this process on the restoration of ecosystem services as landscape scale, during the period from 1992 (baseline) to present. 	SAME; CAMC		Andes, Other (50/50)			190000	USD	CRP - Water, Land and Ecosystems	$130,000		$60,000	$190,000								50%	50%	
50	2	2.2		6.ICARDA	2.2.9	Assessment, through modeling, of the impacts of community-based soil and water conservation interventions on watershed processes in Gondar, Ethiopia 						 Ziadat	ICARDA	80 | Academic, Training and Research			Excessive land degradation owing to erosive rain events and surprisingly shortage of water during dry periods within the rainy season are controversial phenomena. Soil conservation interventions to mitigate land degradation are implemented to cope with the former, while water harvesting in small ponds for supplemental irrigation is implemented to cope with the latter. Understanding the ideal location and selection of these interventions to improve productivity and livelihood will be investigated in a participatory way and using state-of-the-art modeling capabilities. This will help planners and decision makers to allocate various options based on the biophysical and socio-economic setup. The impact on the environment, productivity, water balance will be investigated within a system (watershed) to cover the up-stream down-stream integrated relationships.  This will help in reducing soil and water losses from the watersheds and preserve these resources to improve productivity and livelihood	EAFR	Ethiopia	Nile (100)	Gonder		400000	USD	CRP - Water, Land and Ecosystems	$210,000	$95,000	$95,000	$400,000	100%									
51	2	2.2		6.ICARDA	2.2.10	Evaluation of the downstream consequences on water amounts and quality of implementing supplemental irrigation and water harvesting interventions in upper Karkheh river basin in Iran 						 Oweis	ICARDA	80 | Academic, Training and Research			Evaluation of the downstream consequences on water amounts and quality of implementing supplemental irrigation and water harvesting interventions in upper Karkheh river basin in Iran 	MENA	Iran	Other (100)			344000	USD	CRP - Water, Land and Ecosystems	$78,000	$133,000	$133,000	$344,000									100%	
52	2	2.2		8.ICRISAT	2.2.11	Training, capacity development and technical consultancies for efficient watershed management				2013		 Wani	ICRISAT	80 | Academic, Training and Research				SASI; SEAS		Mekong, Other (50/50)			226650	USD	CRP - Water, Land and Ecosystems	$89,517		$137,133	$226,650							50%		50%	
53	2	2.2		9.IFPRI	2.2.12	The Relationship between Soil Degradation, Rural Livelihoods, and Household Well-Being						 Nkonya	FPRI	80 | Academic, Training and Research				EAFR		Nile (100)			37745	USD	CRP - Water, Land and Ecosystems			$37,745	$37,745	100%									
54	2	2.3		10.IITA	2.3.1	Management of Millet Head Borer to Increase Pearl Millet Production in the Sahel 				2013		 Tamo	IITA	80 | Academic, Training and Research			Management of Millet Head Borer to Increase Pearl Millet Production in the Sahel 			Volta & Niger, Global (50/50)	Sahel		7227	USD	CRP - Water, Land and Ecosystems			$7,227	$7,227		50%								50%
55	2	2.3		2.Bioversity	2.3.2	Implementation of a programme of work for the use of intra-specific crop diversity to provide agroecosystem services and resilience to regulate abiotic and biotic stress (Nepal, Uzbekistan and Kazakhstan).				2018		 Sthapit	Bioversity	80 | Academic, Training and Research			First assessment of farmer use of intra-specific crop diversity to improve ecosystem services and manage unpredictable environmental change (Nepal); Preparation of the Full Project document (Uzbekistan and Kazakhstan)	CASI; SASI		Indus & Ganges (100)			662818	USD	CRP - Water, Land and Ecosystems	$250,573		$412,245	$662,818						100%				
56	2	2.3		2.Bioversity	2.3.3	Quantifying the role of intra-specific crop diversity to regulate pest and diseases in agricultural ecosystems				2015		 Jarvis	Bioversity	80 | Academic, Training and Research			Through the improved use of production systems crop genetic diversity to sustain food production and improve ecosystem health, this activity will: Test practices and procedures to determine and optimally use crop genetic diversity to reduce pest and disease pressures;  Enhance pro-poor capacity and leadership of farmers and other stakeholders to use local crop genetic diversity to manage pests and diseases; and Implement actions to support scaling up of genetic-diversity-rich methods to reduce crop damage and sharing of the benefits derived.	EAFR; EASI; NAFR; SAME		Nile, Indus & Ganges, Andes, Global (25 each)			816055	USD	CRP - Water, Land and Ecosystems	$433,911		$382,144	$816,055	25%					25%		25%		25%
57	2	2.3		2.Bioversity	2.3.4	Agrobiodiversity  use in Sri Lankan agroecosystems for  adaptation and ecosystem resilience to climate change				2018		 Hodgkin	Bioversity	80 | Academic, Training and Research			"Through an integrated ecosystem approach, this activity aims to:  Support for the maintenance of traditional materials and practices that sustain on-farm
diversity together with the development and introduction of new adaptive practices and materials; Focus on the livelihood and household economic
aspects and on securing income, nutrition and health benefits from agrobiodiversity; Develop of supportive policies and institutional frameworks combined with the necessary capacity development, education and public awareness activities."	SASI		Other (100)			348060	USD	CRP - Water, Land and Ecosystems	$69,031		$279,029	$348,060									100%	
58	2	2.3		2.Bioversity	2.3.5	Use of agrobiodiversity for ecosystem resilience in managed and natural Landscapes (Cuba and pastoral ecosystems)				2018		 Eyzaguirre	Bioversity	80 | Academic, Training and Research			Implementation of a programme of work for the use of  agrobiodiversity for ecosystem resilience in Man and the Biosphere Reserves in Cuba.  Implementation of programme on optimal resources utilization for promoting the resilience and service of farming and pastoral ecosystem in China.	EASI; CAMC		Other (100)			735438	USD	CRP - Water, Land and Ecosystems	$344,128		$391,310	$735,438									100%	
59	2	2.3		2.Bioversity	2.3.6	Improving the availability and use of diverse seed and other planting materials to reduce vulnerability and improve food security for smallholders in vulnerable ecosystems;  Advocacy for agricultural biodiversity conservation and research policy linkage				2016		 Lopez; Jarvis	Bioversity	80 | Academic, Training and Research			Definition of research questions; selection of project sites and crops in 5 countries; characterization of seed systems in each site, by surveying seed suppliers in local markets and existing practices, procedures and regulations; identification of  existing gaps in seed systems; refinement of indicators for productivity and resilience. Explore concepts and practical examples of conservation and food sovereignty constituencies coming together and combining efforts to set a new agenda for agriculture, and to identify the kinds of strategies and partnerships this will require.  			Nile, Volta & Niger, Amu Darya & Sur Darya, Indus & Ganges, Andes (20 each)			849097	USD	CRP - Water, Land and Ecosystems	$248,333		$600,764	$849,097	20%	20%		20%		20%		20%		
60	2	2.3		2.Bioversity	2.3.7	Develop a framework for agrobiodiversity and ecosystem services for CRP5				2013		 De Clerck	Bioversity	80 | Academic, Training and Research			"Biodiversity will lead CRP wide development of a research and development framework for Ecosystem Services and Resilience. Three framework will service to guide CRP level work by establishing a clear and practical set of guidelines for integrating ecosystem service and resilience thinking into the various SRP's. This activity will focus on intercenter collaboration. The primary objectives include: The advisory group aims to provide critical feedback and guide research on ecosystem services in the Water Land and Ecosystems CRP. Goals of the Advisory Group are to:

1) Develop a framework for ecosystem service research within WLE that serves to guide collaborative research projects within the CRP.
2) Provide a synthesis of current and on-going work and key collaborators working on the measurement and monitoring of ecosystem services at landscape and basins scales both within the CGIAR and out. For example this would include on-going work with InVest by the Natural Capital Project, ARIES with Conservation International, the Africa Monitoring System or the World Bank effort to develop national indicators of Natural Capital.
3) Develop a set of metrics and standardized protocols for measuring priority ecosystem services at landscape, national, and basin scales with a particular focus on metrics that bridge the gap between disciplines – ecological, sociological, political and economic.
4) Set the agenda for major research questions on ecosystem services and resilience for CRP 5 and expected outcomes; secure additional CGIAR and Restricted funding to support Ecosystem Service based research in CRP5.    "	Global		00 | Global			1083305	USD	CRP - Water, Land and Ecosystems	$574,024		$509,282	$1,083,305										100%
61	2	2.3		3.CIAT	2.3.8	Addressing the challenges of smallholder farming communities: Restoring Degraded Agroecosystems (Pipeline)				2015		 Augusto Castro; Fonte; Glenn Hyman	CIAT	80 | Academic, Training and Research			Improve livelihoods of the rural poor in the tropics by restoring degraded soils and landscapes to enhance agricultural productivity and sustainability in an era of climate change.	LAC; Global		Other, Global (50/50)			518653	USD	CRP - Water, Land and Ecosystems			$518,653	$518,653									50%	50%
62	2	2.3		9.IFPRI	2.3.9	Mobile agent-based ecosystem services management in smallholder landscapes – Southeast Asia and South America						 Bell; Zhang	FPRI	80 | Academic, Training and Research			"The maintenance of less-disturbed vegetation in agricultural landscapes provides habitat for beneficial insects, promoting a class of services such as pollination and pest control that are collectively referred to as mobile agent-based ecosystem services (MABES).  Patches of land on which MABES are enhanced can provide spatially far-reaching benefits, but a problem arises in fragmented smallholder farming landscapes as to whose land should become the host.  The land available to a farmer, along with the set of available inputs, shape the opportunity cost of keeping land in productive use; further, the structure and security of institutions for land tenure – held privately, collectively, or by the state – shape the incentives farmers have to make investments in farm structure. The goal of our research is to improve MABES management and reduce the use of chemical pesticides through coordinated action across farmers at the landscape scale. Our key research questions are:
1) How do farmer objectives, and incentives to coordinate, vary across property size and institutional arrangements for tenure?
2) What are the most appropriate interventions to optimize MABES management across these different size and institutional contexts?
We propose a three-year, three-country (Cambodia, Vietnam, China) study to design and evaluate incentives for MABES management, taking into account heterogeneity in property size and institutional arrangements for property rights that characterize China and Southeast Asia.  Our choice of countries leverages existing research in Northern China, and covers landscapes i) where smallholder properties are unvaryingly small (> 2ha; Cambodia, China, and areas in North Vietnam) as well as where some consolidation has occurred (> 10ha; Southern Vietnam); and ii) with different prevalence of private property rights (Southern Vietnam and China), collective farming systems (Northern Vietnam), and threats to tenure security (Cambodia).
Our research will combine modeling study with household survey.  Drawing on existing MABES research in China and published models of MABES provision, a spatially explicit agent-based model of agricultural households will be developed to i) propose candidate incentives for managing MABES and reducing pesticide use, and ii) identify key variables in farmer decision making for the household survey.  Survey research in chosen agricultural contexts (Cambodia, Southern Vietnam, Northern Vietnam, and Northern China) will follow a 2-stage random sampling design of agricultural communities and households within them, post-stratifying by wealth, property size, land tenure system, and current reliance on pesticides.  This survey research will inform the understanding of household level objective functions, decision-making criteria, and community network structure, and will feed back into a detailed agent-based model of farming decisions within the agricultural landscape.  Coupled to existing ecological models of MABES provision, we will apply this modeling framework to evaluating and comparing alternative incentives for MABES management and draw implications on reducing pesticides use.
"	SAME; SEAS		Mekong, Other (80/20)			230188	USD	CRP - Water, Land and Ecosystems	$230,188			$230,188							80%		20%	
63	2	2.4		11.ILRI	2.4.1	Raise money for external funding for specific projects and contribute to SRP 2 development						 Ericksen	ILRI	80 | Academic, Training and Research			Attend SRP 2 workshops; write proposals on mapping or resource tenure arrangements in pastoral system; inventoryof adaptation practices/ eco-efficiency in mixed crop-livestock systems.	Global		Other, Global (50/50)			54905	USD	CRP - Water, Land and Ecosystems	$54,905			$54,905									50%	50%
64	2	2.5		12.IWMI	2.5.1	Improved agricultural water management in rainfed production systems.						Katherine Snyder	IWMI	80 | Academic, Training and Research			"Reducing the risks associated with rainfall variability that is an innate attribute of rainfed production systems is critical to enhancing the performance of these agricultural production systems. To best achieve this agricultural water management at both the field and landscape scales are seen as part of the mix of solutions to enhance the productivity of these systems. To achieve this ongoing and new initiatives that focus on improving agricultural water management have been mapped to this activity. The overarching objective of this initiative is to build a comprehensive cluster of projects that would contribute to Activity cluster 2.5.  
There are current activities that are ongoing that attempt to address the risk associated with rainfall variability in these environments through the role of enhancing the productivity of light textured soils through the addition of clay, organic matter, biochar and combinations thereof that are being evaluated under rainfed systems in Lao PDR. Over the coming year collection and analysis of data from structured field trials will be undertaken and presented in peer reviewed publications and reports.
A scoping study on opportunities to improving the sustainable utilization and management of water and soil resources for coastal Vietnam will be undertaken as a precursor to a larger project to be funded in mid-2013.
In the development of a comprehensive cluster of projects to be undertaken within the Rainfed SRP efforts will be made to formulate a suite of new projects that would contribute to the 5 activity clusters within the SRP. The following proposed research areas could be considered:
1. Building upon the outcomes from the CPWF suite of projects in the Nile and Volta, research proposals that focus on the role of termites in ecosystem services (N2) and fire as a management tool (V4) will be developed.
2. Understanding impediments to scaling up adoption rates in rainfed systems and developing strategies and options to obviate these barriers.
3. The role of supplemental irrigation in improving the productivity of rainfed systems.
4. Understanding the impacts of scaling up agricultural water management (AWM) interventions and optimizing in situ water storage.
This process will be undertaken in consultation with CGIAR centres aligned to SRP Rainfed, stakeholders and other interested parties through face to face meetings and virtual discussion groups. "	SEAS		Nile, Volta & Niger,Limpopo & Zambezi, Mekong (25 each)			682661	USD	CRP - Water, Land and Ecosystems	$682,661	$0	$0	$682,661	25%	25%	25%				25%			
