no	SRP	Cluster	2nd	Center	cg_internal	title	(select from list)	start_Planned	start_Actual	end_Planned	end_Actual	contact	rep_org_name	rep_org_type	part_org_name	part_org_role	Description	regions	countries	effort_by_basin	Admin	Site	yearly_budget	currency	(select from list)	W1&2	W3	Bilateral	Total	Nile	Volta & Niger	Limpopo & Zambezi	Amu Darya & Sur Darya	Tigris & Euphrates	Indus & Ganges	Mekong	Andes	Other	Global
65	2	2.5		8.ICRISAT	2.5.2	Assessing impact of AWM interventions in different rainfall zones				2013		 Anantha	ICRISAT	80 | Academic, Training and Research			Monitoring and modeling of various hydrological components and ecosystem services in differnet ecological regions; Developing various agricultural water managemnet interventions at farm and community scale at pilot sites; Conducting farmers participatory land form trails with different cropping systems at pilot watershed and also at reseach station; Experimenting various tillage and conservation agriculture options and analyzing its impact on hydrology, crop yield and ecosystem services at research station and pilot sites; Demostrating various agricultural water management interventions, conservation practices, nutrinet management, improved agronomic practcies at pilot sites; Training, field days, exposure visits and workshops will be organised	Global		Nile, Global (65/35)			371300	USD	CRP - Water, Land and Ecosystems	$146,648		 $224,652.00 	$371,300	65%									35%
66	3	3.1		12.IWMI	3.1.1	Compilation and analysis of 50 RRR success stories		1-Dec-11		30-Nov-14		Miriam Otoo	IWMI	80 | Academic, Training and Research			Finalization of Resource Recovery Business Model Catalogues	Global		00 | Global			953747	USD	CRP - Water, Land and Ecosystems	$308,005	$0	$645,742	$953,747										10%
67	3	3.1		12.IWMI	3.1.2	Analysis of 30 existing, emerging and possible RRR business models 		1-Jun-11		31-Dec-13		Miriam Otoo	IWMI	80 | Academic, Training and Research			Feasibility studies for RRR business model implementation at scale	EAFR; SAME; SASI; SEAS	Uganda; Peru; India; Vietnam	Nile, Amu Darya & Sur Darya, Indus & Ganges, Global (20/20/20/40)	Kampala; Lima; Bangelore; Hanoi		953747	USD	CRP - Water, Land and Ecosystems	$308,005	$0	$645,742	$953,747	20%			20%		20%				40%
68	3	3.1		12.IWMI	3.1.3	Research and knowledge sharing on options to enhance urban and peri-urban agriculture 		1-May-11		31-Oct-12		Priyanie Amerasinghe	IWMI	80 | Academic, Training and Research			Research and knowledge sharing on options to enhance urban and peri-urban agriculture in support of guidelines	SASI	India; Sri Lanka	Indus & Ganges, Other (20/80)			158994	USD	CRP - Water, Land and Ecosystems	$111,598	$0	$47,396	$158,994						20%			80%	
69	3	3.2		12.IWMI	3.2.1	Making a safe asset out of  wastewater and excreta (treatment/sanitizing, composting, blending, pelletizing)		1-Jan-12		31-Dec-14		Josiane Nikiema;   Priyanie Amarasinghe;  Philip  Amoah	IWMI	80 | Academic, Training and Research			Research, training and policy development on safe use of septage and wastewater in urban and peri-urban agriculture 	Global		Nile, Volta & Niger, Limpopo & Zambezi, Amu Darya & Sur Darya, Tigris & Euphrates, Indus & Ganges, Mekong, Andes, Other, Global (10 each)			307262	USD	CRP - Water, Land and Ecosystems	$140,745	$0	$166,517	$307,262	10%	10%	10%	10%	10%	10%	10%	10%	10%	10%
70	3	3.2		6.ICARDA	3.2.2	Community-based Interventions for Productive Use of Greywater in home farming (Jordan, Lebanon and Palestine)						 Boufaroua	ICARDA	80 | Academic, Training and Research			the project will focuss on the the achievement of better livelihoods through the efficient and sustainable use of available water resources in dry areas. The project addressed improvement in grey-water quality and community-based interventions leading to the safe and productive use of grey-water for crop production systems at the household level. Moreover, the project implemented grey-water collection, treatment, and its productive use in home farming for income generation at the household level.	MENA	Jordan; Lebanon; Palestine	Other (100)			92000	USD	CRP - Water, Land and Ecosystems	$48,000	$22,000	$22,000	$92,000									100%	
71	3	3.2		6.ICARDA	3.2.3	Safe and Productive Use of Treated Wastewater and Greywater in irrigation in Palestine   (West Bank)						 Haddad; Boufaroua	ICARDA	80 | Academic, Training and Research			Exploiting the potential of valuable marginal water resources (grey and waste water). The main activities planned: (1) baseline information to undertake assessment of water resources and quality and quantity of marginal-quality water resources; (2) policy, institutional, and socio-economic dimensions of water resources and their use in different sectors; (3) research and technology transfer for the use of treated wastewater and greywater in agriculture; and (4) human and institutional capacity development. 	MENA	Palestine	Other (100)	West Bank		92000	USD	CRP - Water, Land and Ecosystems	$48,000	$22,000	$22,000	$92,000									100%	
72	3	3.2		6.ICARDA	3.2.4	Safe and Productive Use of Treated Wastewater and Greywater in Palestinian Territories (Gaza)						 Haddad; Boufaroua	ICARDA	80 | Academic, Training and Research			"With the goal of better livelihoods through improved and sustainable use of available water resources in Palestinian territories (Gaza), the proposed project aims to address the new techniques of using treated wastewater/grey water which aims to optimize the  quality and quantity of wastewater and greywater available, improvement in wastewater and greywater quality, and interventions leading to safe and productive use of wastewater for crop production systems at the farm level and similar use of greywater at the household level.

"	MENA	Palestine	Other (100)	Gaza		92000	USD	CRP - Water, Land and Ecosystems	$48,000	$22,000	$22,000	$92,000									100%	
73	3	3.2		8.ICRISAT	3.2.5	Wastewater reuse in agriculture				2016		 Wani	ICRISAT	80 | Academic, Training and Research			Selection of benchmark sites and baseline data collection; Formation and optimization of fungal consortia for wastewater treatment; Constructed wetlands for wastewater treatment; Conducting field scale experiments to analyze suitability of wastewater in agriculture; Laboratory/pot- scale study for identifying transport  processes in soil			Other (100)			1208000	USD	CRP - Water, Land and Ecosystems	$99,000		$1,109,000	$1,208,000									100%	
74	4	4		9.IFPRI	4.0.0	Liaison and travel budget for theme leader				30-Jun-15		 Claudia Ringler	FPRI	80 | Academic, Training and Research			Three trips in 2013 and associated time, 10 additional days, 5 days for budget administrator, 5k collab, 20k co-financing	Global					105130	USD	CRP - Water, Land and Ecosystems	105130			$105,130										
75	4	4.1		11.ILRI	4.1.0	contribute to implementation of CPWF projects						 Duncan; Ayantunde	ILRI	80 | Academic, Training and Research				EAFR		Nile, Volta & Niger (50/50)			1246952	USD	CRP - Water, Land and Ecosystems	 $141,095 		 $1,105,857 	$1,246,952	50%	50%								
76	4	4.1		12.IWMI	4.1.1	Evaluating various options for water storage planning and operation in various geographical and institutional contexts						Matthew McCartney	IWMI	80 | Academic, Training and Research			CRP5 - natural and built infrastructure i) Development of an approach for auditing/inventory of natural and built infrastructure in basins;  ii) Comparative analyses on how differing rainfall-runoff relationships in different basins alter water availability and  constrain / provide opportunities for varying services; iii) Functional assessment to determine how different services are provided by different natural and built infrastructure;	EAFR; SAFR; SASI; SEAS; WAFR		Indus & Ganges, Mekong, Other (30/30/40)			598275	USD	CRP - Water, Land and Ecosystems	$598,275	$0		$598,275						30%	30%		40%	
77	4	4.1		12.IWMI	4.1.2	Evaluating various options for water storage planning and operation in various geographical and institutional contexts						Matthew McCartney	IWMI	80 | Academic, Training and Research				SEAS; WAFR					699916	USD	CRP - Water, Land and Ecosystems	$246,959	$0	$452,957	$699,916										
78	4	4.1		12.IWMI	4.1.3	Evaluating potential for basin-wide harvesting of flood waters underground in Asia in  various geographical and institutional contexts				31-Dec-14		Paul Pavelic	IWMI	80 | Academic, Training and Research			Synthesis of global flood events and impacts and groundwater storage capacity hotspots	Asia					552974	USD	CRP - Water, Land and Ecosystems	$552,974	$0	$0	$552,974										
79	4	4.1		12.IWMI	4.1.4	Evaluating the potential of improved operation of Akosombo Dam in Ghana through introduction of Environmental water management aspects				31-Dec-15		Regassa; Fred Namara; Kizito	IWMI	80 | Academic, Training and Research			Development of the environmental management plan for the operation of the Akosombo Reservoir	WAFR	Ghana	Volta & Niger (100)	Akosombo dam		177372	USD	CRP - Water, Land and Ecosystems	$62,584	$0	$114,788	$177,372		100%								
80	4	4.1		12.IWMI	4.1.5	Improving water management in the Syrdarya and Amudarya basins by conjunctive management of groundwater and surface water				31-Dec-14		Akmal Karimov	IWMI	80 | Academic, Training and Research			A) Two groups of field, simulation and analyses focusing on i) LIFT IRRIGATED AREAS ON FOOTHILLS OF NORTHERN TAJIKISTAN (Syr Darya) and ii) ENHANCING WATER STORAGES OF THE KARSHI STEPPE by managed aquifer recharge MAR - AMUDARYA); b) Evaluation of advanced MAR technologies in both basins	CASI	Uzbekistan; Tajikistan	Amu Darya & Sur Darya (100)	Karshi steppe; Ferghana valley		221715	USD	CRP - Water, Land and Ecosystems	$221,715	$0	$0	$221,715				100%						
81	4	4.1		12.IWMI	4.1.6	Consolidating IWMI modeling and spatial analysis strategy				1-Sep-14		Robyn Johnston; Luna Bharati; Asad  Qureshi 	IWMI	80 | Academic, Training and Research			This is a suit of activities related to i) Completion of CIDA-funded Koshi modeling for storage assessment ii) Windows funded WEAP modeling of Indus iii) Visionary Report or JA on the need for better coordination of modeling activities worldwide in various basins that may better target donor investment, etc. 	Global; SASI	Nepal	Indus & Ganges, Global (50/50)	Koshi basin		185164	USD	CRP - Water, Land and Ecosystems	 $162,407 	 $22,757 	 $-   	$185,164						50%				50%
82	4	4.1	5.1	5.CPWF	4.1.7	Integrated management of rainwater to improve smallholder  productivity and livelihoods and reduce risk; Targeting and scaling out in the Limpopo						 Barron	CPWF	80 | Academic, Training and Research			Research to understand spatial patterns of adoption and scaling out of soil-water conservation structures, irrigation infrastructure rehabilitation, and improved crop-livestock systems in the Limpopo basin. 	SAFR		Limpopo & Zambezi (100)			91744	USD	CRP - Water, Land and Ecosystems	$91,744			$91,744			100%							
83	4	4.1	5.1	5.CPWF	4.1.8	Integrated management of rainwater and small reservoirs for multiple uses;  Coordination and change						 Cofie	CPWF	80 | Academic, Training and Research			Development of consistent storylines across the VBDC projects to provide a framework within which the projects can formulate specific scenarios and appropriate interventions to address  the VBDC challenge , Ethnographic research to understand the research and change process in the VBDC, Multiple activities related to fostering cross-project integration, maintaining basin research program coherence, engaging with senior policymakers, exploring scaling out opportunities, providing communications leadership, and participating in project M&E	WAFR		Volta & Niger (100)			307032	USD	CRP - Water, Land and Ecosystems		$307,032		$307,032		100%								
84	4	4.1	4.3	5.CPWF	4.1.9	Optimizing reservoir management for livelihoods in the Mekong						 Senaratne Sellamuttu	CPWF	80 | Academic, Training and Research			Research in several sub-basins in the Mekong to identify improved livelihoods activities associated with hydropower reservoir management and water release schedules; specific opportunities to improve livelihoods vary across sub-basins	SEAS		Mekong (100)			401196	USD	CRP - Water, Land and Ecosystems	$401,196			$401,196							100%			
85	4	4.1	4.3	5.CPWF	4.1.10	Water valuation in the Mekong						 Kura	CPWF	80 | Academic, Training and Research			Research in several sub-basins in the Mekong to quantify the value of water in different uses, given livelihoods improvements options and existing or planned hydropower infrastructure. For each sub-basin, household surveys are conducted; water valuation frameworks developed; and hydrological scenarios used for trade-off analysis.	SEAS		Mekong (100)			21953	USD	CRP - Water, Land and Ecosystems	$21,953			$21,953							100%			
86	4	4.1	4.3	5.CPWF	4.1.11	Coordination of multi-stakeholder platforms in the Mekong((coordination and change project)						 Geheb	CPWF	80 | Academic, Training and Research			Multiple activities related to fostering cross-project integration, maintaining basin research program coherence, engaging with senior policymakers, exploring scaling out opportunities, providing communications leadership, and participating in project M&E Management of large AusAID grant for launch of several research projects complementary to those of the original Mekong BDC program	SEAS		Mekong (100)			468626	USD	CRP - Water, Land and Ecosystems	$468,626			$468,626							100%			
87	4	4.1		5.CPWF	4.1.12	Mekong Dam Development ; Dammed If.. 						 Victor	CPWF	80 | Academic, Training and Research			Produce an objective, science based film on the Mekong focused on livelihoods, governance and fisheries along with 3 thematic shorts in a at least 4 languages , Show the film regionally in the Goethe Science Film festival, Website and other dissemination activities carried out 	SEAS		Mekong, Global (80/20)			27000	USD	CRP - Water, Land and Ecosystems			$27,000	$27,000							80%			20%
88	4	4.1	5.1	5.CPWF	4.1.13	Assessing and anticipating consequences of innovation In the Nile						 MacAlister	CPWF	80 | Academic, Training and Research			Research to understand the Nile basin consequences of upstream changes in land and water management. Activities include SWAT modification and application, WEAP modification and application, improvement and use of global soil and water data sets for climate reanalysis for Africa, and introduction of optimization models that incorporate economic performance criteria.	EAFR	Ethiopia	Nile(100)			342360	USD	CRP - Water, Land and Ecosystems	$342,360			$342,360	100%									
89	4	4.1	4.2	5.CPWF	4.1.14	Coordination and change enabling project 						 Meisner	CPWF	80 | Academic, Training and Research			Multiple activities related to fostering cross-project integration, maintaining basin research program coherence, engaging with senior policymakers, exploring scaling out opportunities, providing communications leadership, and participating in project M&E	SASI	Bangladesh; India	Indus & Ganges (100)	West Bengal		354333	USD	CRP - Water, Land and Ecosystems	$354,333			$354,333						100%				
90	4	4.1	5.1	5.CPWF	4.1.15	Integrated management of rainwater and small reservoirs for multiple uses;  Targeting and scaling out 						 Barron	CPWF	80 | Academic, Training and Research			Research to understand spatial patterns of adoption and scaling out of soil-water conservation structures vs. small reservoirs vs. small pumps in study areas of the Volta basin. 	WAFR		Volta & Niger (100)			121792	USD	CRP - Water, Land and Ecosystems		$121,792		$121,792		100%								
91	4	4.2	4.4	12.IWMI	4.2.1	Developing a prototype surface- and ground- water balance approach for assessment of  watershed interventions						Paul Pavelic	IWMI	80 | Academic, Training and Research			Developing simple model to describe hydrological processes that can explore CU and upstream-downstream linkages			Other (100)			224986	USD	CRP - Water, Land and Ecosystems	$79,384	$0	$145,602	$224,986									100%	
92	4	4.2	4.4	12.IWMI	4.2.2	Developing a methodology for assessment of basin-wide soil salinity based on RS-vegetation data and field measurements of salinity						Asad Qureshi	IWMI	80 | Academic, Training and Research			i) Analysis of linkages between groundwater table depth, soil salinity and crop yields in basins of central and southern Iraq. Ii) Analysing current status of irrigation and drainage infrastructure in river basins in Iraq, and investments needed to rehabilitate it.	MENA	Iraq	Tigris & Euphrates (100)			25453	USD	CRP - Water, Land and Ecosystems	$8,981	$0	$16,472	$25,453					100%					
93	4	4.2	4.4	12.IWMI	4.2.3	Selection and adaptation of indicators and devices for improvement of agricultural productivity in irrigated areas of river basins				31-May-14		Regassa Namara	IWMI	80 | Academic, Training and Research			Monitoring of key parameters that determine current constraints to food production in study areas ii)  evaluation of agro-ecological and socio-economic impacts of improved practices and/or innovations after implementation.  iii) Application of  IWMI's irrigation diagnosis and planning tool (OASIS) at irrigation schemes in Ethiopia and Moazambique.iv) contribution to  linking the partner's PILOTE model and the Steady State Salinity Modeling Platform (SSSMP)	EAFR; SAFR	Ethiopia; Mozambique	Volta & Niger, Limpopo & Zambezi (50/50)			130914	USD	CRP - Water, Land and Ecosystems	$46,192	$0	$84,722	$130,914		50%	50%			 	 			
94	4	4.2		12.IWMI	4.2.4	Fieldwork on Payments for Ecosystem Services in Nepal, Laos and Vietnam						Chu Thai Hoanh	IWMI	80 | Academic, Training and Research			i) Implement the survey and analysis on microfinance, cost-benefit, livelihoods and institutional structures for PES and benefit sharing of reservoir development in Laos, Vietnam and Nepal                                                                                                                                                                                                                                                               ii) Organize a regional conference on benefit sharing of reservoir development for sharing lessons from different countries	SASI; SEAS	Nepal; Lao PDR; Vietnam	Indus & Ganges, Mekong (20/80)			634763	USD	CRP - Water, Land and Ecosystems	$223,970	$0	$410,793	$634,763						20%	80%			
95	4	4.2		12.IWMI	4.2.5	Synthesis of water policy research on i) human rights and gender dimensions of AWM in South Africa and ii) Politics of IWRM in Africa				30-Jun-15		Barbara van Koppen	IWMI	80 | Academic, Training and Research			i) Historical analysis of women's socio-economic human rights in the Flag Boshielo Irrigation Scheme, in the light of South Africa's national rights-based policies and laws; ii) Historical analysis of operationalization and implementation of IWRM concepts in water policies and laws in South Africa; iii) support to a component  study led by Sokoine University of Agriculture in Tanzania 	EAFR; SAFR	Tanzania; South Africa	Limpopo & Zambezi (100)	Flag Boshielo irrigation scheme		99275	USD	CRP - Water, Land and Ecosystems	$35,028	$0	$64,247	$99,275			100%							
96	4	4.2		12.IWMI	4.2.6	Support to the Ramsar convention on wetlands;  synthesis of scientific information on large wetlands, and on large-scale wetland monitoring						Matthew McCartney; Lisa-Maria Rebelo	IWMI	80 | Academic, Training and Research			i) Support to various working groups (e.g. wetlands and agriculture, wetlands and poverty alleviation, wetlands and climate change) of the Ramsar Science and Technical Review Panel. ii) Co-organising RAMSAR side event on Wetlands monitoring by Earth Observation Satellites – Current State of the Art (organized by JAXA, IWMI and ESA) Ii) Syntheses of knowledge on  Sudd Processes and ESs 	Global		00 | Global	Sudd		75000	USD	CRP - Water, Land and Ecosystems	$75,000	$0	$0	$75,000										100%
97	4	4.2		12.IWMI	4.2.7	Improving groundwater use for irrigation in the Greater Mekong Sub region (GMS) 				31-Dec-14		Paul Pavelic	IWMI	80 | Academic, Training and Research			Groundwater use for irrigation is virtually non-existent in Lao PDR and minimal across the Greater Mekong Sub-region (GMS) (with few exceptions). Based on experiences from other regions which have intensified groundwater use as well as knowledge from the GMS, there is the potential for expansion if existing barriers can be overcome.	SEAS	Lao PDR	Mekong (100)	GMS		1049037	USD	CRP - Water, Land and Ecosystems	 $370,143 	 $678,894 	 $-   	$1,049,037							100%			
98	4	4.2		12.IWMI	4.2.8	Evaluating the role of large  transboundary aquifers for food security in Southern Africa						Karen Villholth	IWMI	80 | Academic, Training and Research			Groundwater use for irrigation is limited in Southern Africa, while surface water resources are getting overused. The boost to local agriculture through water shall come from exploitation of large transboundary aquifers (TBAs). 	SAFR		Limpopo & Zambezi (100)			150000	USD	CRP - Water, Land and Ecosystems	 $150,000 	 $-   	 $-   	$150,000			100%							
99	4	4.2		12.IWMI	4.2.9	Enhancing water availability through recharge and groundwater management						S.A. Prathapar	IWMI	80 | Academic, Training and Research			Improve the security of irrigation water supplies and enhance livelihood opportunities for rural communities.  It aims to develop or adapt suitable best practice guidelines and modeling and assessment tools conducted in Sabarkantha district in Gujarat and Udaipur district in Rajasthan.  In this activity, systemic analysis of the groundwater situation and livelihood opportunities will be carried out through an approach involving, agricultural, environmental, social and economic considerations. 	SASI	India	Indus & Ganges (100)	Gujarat & Udaipur, Rajasthan		36750	USD	CRP - Water, Land and Ecosystems	$36,750	$0		$36,750						100%				
100	4	4.2		13.WorldFish	4.2.10	Supporting the development of operational measures for mitigating dam impacts on fisheries through informing the design of fish passes in the Mekong 						 Baran	WorldFish	80 | Academic, Training and Research			Conduct survey of fish migrations through the Khone Falls in Laos and use this area as a natural laboratory to assess the swimming capabilities and the hydro-geomorphologic requirements of dominant migratory fish species, in support of fish passe designs that are suitable for Mekong fisheries	SEAS	Lao PDR	Mekong (100)	Khone falls		197000	USD	CRP - Water, Land and Ecosystems			$197,000	$197,000							100%			
101	4	4.2	4.3	13.WorldFish	4.2.11	Harmonizing the water–energy–environment nexus though trade-off analysis and mitigation strategies for fisheries and aquatic resources				31-Dec-14		 Kura	WorldFish	80 | Academic, Training and Research			Develop partnerships with both CGIAR and non-CGIAR research institutions, such as universities, international NGOs, and intergovernmental organizations, in generating donor interest and political will for more balanced water development strategies in the Lower Mekong region, through jointly conducting research and capacity building of local partners and stakeholders.	SEAS		Mekong (100)			170000	USD	CRP - Water, Land and Ecosystems	$170,000			$170,000							100%			
102	4	4.2		3.CIAT	4.2.12	Socioeconomic and environmental impact indicators for conservation agriculture in the Colombian Andes 						 Marcela Quintero	CIAT	80 | Academic, Training and Research				SAME	Colombia	Andes (100)			120263	USD	CRP - Water, Land and Ecosystems	$116,950		$3,313	$120,263								100%		
103	4	4.2		3.CIAT	4.2.13	Cross-learning exchange between Central America and South America expertise on designing eco-efficient land use alternatives to deliver water and carbon-related ecosystem services						 Marcela Quintero; Augusto Castro	CIAT	80 | Academic, Training and Research				CAMC; SAME		Andes, Other (50/50)			15000	USD	CRP - Water, Land and Ecosystems	$15,000			$15,000								50%	50%	
104	4	4.2		3.CIAT	4.2.14	support cross-regional, regional and national analysis and activities oriented to understand, analyze and discuss the evolution of PES-type schemes an to provide recommendations and insights for new initiatives in this topic.						 Marcela Quintero; Tapasco	CIAT	80 | Academic, Training and Research			New research activities initiated and oriented to analyze and synthetize results and lessons on BSM in LAC	CAMC; SAME		Andes (100)			85000	USD	CRP - Water, Land and Ecosystems	$85,000			$85,000								100%		
105	4	4.2		3.CIAT	4.2.15	Managing ecosystem services for food security and the nutritional health of the rural poor at the forest agricultural interface (Colombia and Malawi)						 Andrew Jarvis; Marcela Quintero	CIAT	80 | Academic, Training and Research			Analyses and models to understand the current levels of direct and indirect contributions of ES to local food security and nutritional health  for the rural poor 	SAFR; SAME	Malawi; Colombia	Other (100)			457896	USD	CRP - Water, Land and Ecosystems	$118,419		$339,477	$457,896									100%	
106	4	4.2	2.1	5.CPWF	4.2.16	Designing and implementing benefit sharing mechanisms in the Andes - 1				2014		 Escobar	CPWF	80 | Academic, Training and Research			Research in multiple small river basins in the Andes to identify opportunities to sustainably intensify highland agroecosystems, usually using degree days to target intensive dairy interventions, then identify and develop BSM that enable the corresponding investments to be made, with financial assistance from downstream water users	SAME		Andes (100)			240132	USD	CRP - Water, Land and Ecosystems	$240,132			$240,132								100%		
